tweet_id,timestamp,source,text,rating_numerator,rating_denominator,name,dog_stage,expanded_link_1,expanded_link_2,favorite_count,retweet_count,jpg_url,img_num,p1,p1_conf,p1_dog,p2,p2_conf,p2_dog,p3,p3_conf,p3_dog
676533798876651520,2015-12-14 14:46:41-08:00,Twitter for iPhone,ITSOFLUFFAYYYYY  ,12,10,,,https://twitter.com/dog_rates/status/676533798876651520/photo/1,,1931,583,https://pbs.twimg.com/media/CWOH4s9U8AEtkmQ.jpg,1,Chow,0.26527399999999995,True,Ice bear,0.167614,False,Fur coat,0.117506,False
676496375194980353,2015-12-14 12:17:59-08:00,Twitter for iPhone,Say hello to Griffin. He's upset because his costume for Halloween didn't arrive until today.  cheer up pup ,9,10,Griffin,,https://twitter.com/dog_rates/status/676496375194980353/photo/1,,1561,560,https://pbs.twimg.com/media/CWNl3S9WcAARN34.jpg,1,Pug,0.985387,True,Norwegian elkhound,0.0044169,True,French bulldog,0.00389287,True
676470639084101634,2015-12-14 10:35:43-08:00,Twitter for iPhone,Three generations of pupper.  for all ,11,10,,pupper,https://twitter.com/dog_rates/status/676470639084101634/photo/1,,11927,4892,https://pbs.twimg.com/media/CWNOdIpWoAAWid2.jpg,1,Golden retriever,0.7903859999999999,True,Borzoi,0.0228851,True,Dingo,0.0153434,False
676440007570247681,2015-12-14 08:34:00-08:00,Twitter for iPhone,Hope your Monday isn't too awful. Here's two baseball puppers.  for each ,11,10,,pupper,https://twitter.com/dog_rates/status/676440007570247681/photo/1,,1766,695,https://pbs.twimg.com/media/CWMyl9EWUAAnZJ0.jpg,2,Maltese dog,0.579472,True,Toy poodle,0.133446,True,Shih-tzu,0.0943966,True
676430933382295552,2015-12-14 07:57:56-08:00,Twitter for iPhone,"Meet Duke. He's an Urban Parmesan. They know he's scared of the green rubber dog. ""Why u do dis?"" thinks Duke.  ",10,10,Duke,,https://twitter.com/dog_rates/status/676430933382295552/photo/1,,1433,361,https://pbs.twimg.com/media/CWMqV7WUYAEEClG.jpg,1,Golden retriever,0.583875,True,Cocker spaniel,0.203671,True,Labrador retriever,0.0361217,True
676263575653122048,2015-12-13 20:52:55-08:00,Twitter for iPhone,All this pupper wanted to do was go skiing. No one told him about the El NiÃ±o. Poor pupper.  maybe next year ,10,10,,pupper,https://twitter.com/dog_rates/status/676263575653122048/photo/1,,2132,578,https://pbs.twimg.com/media/CWKSIfUUYAAiOBO.jpg,1,Teddy,0.0982826,False,Toy poodle,0.0980293,True,Shopping basket,0.07785210000000001,False
676237365392908289,2015-12-13 19:08:46-08:00,Twitter for iPhone,Say hello to Winston. He has no respect for the system. Much rebellion. I think that's a palm tree... nice.  ,8,10,Winston,,https://twitter.com/dog_rates/status/676237365392908289/photo/1,,1261,306,https://pbs.twimg.com/media/CWJ6Sc-WwAAlpI6.jpg,1,French bulldog,0.961996,True,Chihuahua,0.021793,True,Boston bull,0.00691629,True
676219687039057920,2015-12-13 17:58:31-08:00,Twitter for iPhone,This is Kenneth. He's stuck in a bubble.  hang in there Kenneth ,10,10,Kenneth,,https://twitter.com/dog_rates/status/676219687039057920/photo/1,,76943,32385,https://pbs.twimg.com/media/CWJqN9iWwAAg86R.jpg,1,Bubble,0.997556,False,Leafhopper,0.000158961,False,Whippet,0.000132464,True
676215927814406144,2015-12-13 17:43:35-08:00,Twitter for iPhone,This is Herm. He just wants to be like the other dogs. Sneaky tongue slip. Super fuzzy.  would cuddle firmly ,9,10,Herm,,https://twitter.com/dog_rates/status/676215927814406144/photo/1,,1784,609,https://pbs.twimg.com/media/CWJmzNsWUAE706Z.jpg,1,Hamster,0.999484,False,Guinea pig,0.00015821700000000002,False,Broccoli,6.0911000000000014e-05,False
676191832485810177,2015-12-13 16:07:50-08:00,Twitter for iPhone,These two pups just met and have instantly bonded. Spectacular scene. Mesmerizing af.  and 7/10 for blue dog ,10,10,,,https://twitter.com/dog_rates/status/676191832485810177/photo/1,,2344,1077,https://pbs.twimg.com/media/CWJQ4UmWoAIJ29t.jpg,2,Chihuahua,0.376741,True,Italian greyhound,0.17311400000000002,True,Muzzle,0.07148510000000001,False
676146341966438401,2015-12-13 13:07:04-08:00,Twitter for iPhone,This is Bert. He likes flowers.  ,10,10,Bert,,https://twitter.com/dog_rates/status/676146341966438401/photo/1,,1975,697,https://pbs.twimg.com/media/CWIngp5WEAAJOy3.jpg,1,Irish water spaniel,0.388332,True,Standard poodle,0.284121,True,Greenhouse,0.0348681,False
676101918813499392,2015-12-13 10:10:33-08:00,Twitter for iPhone,Meet Striker. He's ready for Christmas.  ,11,10,Striker,,https://twitter.com/dog_rates/status/676101918813499392/photo/1,,2892,1210,https://pbs.twimg.com/media/CWH_FTgWIAAwOUy.jpg,1,Shih-tzu,0.225848,True,Norfolk terrier,0.186873,True,Irish terrier,0.10698699999999997,True
676098748976615425,2015-12-13 09:57:57-08:00,Twitter for iPhone,Extremely rare pup here. Very religious. Always praying. Too many legs. Not overwhelmingly fluffy. Won't bark.  ,3,10,,,https://twitter.com/dog_rates/status/676098748976615425/photo/1,,3084,1501,https://pbs.twimg.com/media/CWH8L72UkAAvjql.jpg,1,Walking stick,0.162179,False,Sandal,0.12908599999999998,False,Purse,0.0814119,False
676089483918516224,2015-12-13 09:21:08-08:00,Twitter for iPhone,"""Yes hello I'ma just snag this here toasted bagel real quick. carry on.""  ",9,10,,,https://twitter.com/dog_rates/status/676089483918516224/photo/1,,1349,451,https://pbs.twimg.com/media/CWHzzFGXIAA0Y_H.jpg,1,Bull mastiff,0.743808,True,Boxer,0.106697,True,American staffordshire terrier,0.0423353,True
675898130735476737,2015-12-12 20:40:46-08:00,Twitter for iPhone,I'm sure you've all seen this pupper. Not prepared at all for the flying disc of terror.  ,10,10,,pupper,https://twitter.com/dog_rates/status/675898130735476737/photo/1,,1668,597,https://pbs.twimg.com/media/CWFFt3_XIAArIYK.jpg,1,Labrador retriever,0.40743,True,Malinois,0.0770367,True,Pug,0.0745973,True
675891555769696257,2015-12-12 20:14:39-08:00,Twitter for iPhone,This is Donny. He's summoning the demon monster Babadook.  Donny please no that won't be a good time for anyone ,6,10,Donny,,https://twitter.com/dog_rates/status/675891555769696257/photo/1,,2183,906,https://pbs.twimg.com/media/CWE_x33UwAEE3no.jpg,1,Italian greyhound,0.305637,True,Whippet,0.232057,True,Great dane,0.117806,True
675888385639251968,2015-12-12 20:02:03-08:00,Twitter for iPhone,Breathtaking scene. A father taking care of his newborn pup. Tugs at the heartstrings.  restores my faith ,10,10,,,https://twitter.com/dog_rates/status/675888385639251968/photo/1,,2437,1003,https://pbs.twimg.com/media/CWE85snWIAEG5ES.jpg,1,West highland white terrier,0.672117,True,Old english sheepdog,0.146147,True,Komondor,0.023141400000000003,True
675878199931371520,2015-12-12 19:21:34-08:00,Twitter for iPhone,"Ok, I'll admit this is a pretty adorable bunny hopping towards the ocean but please only send in dogs...  ",11,10,,,https://twitter.com/dog_rates/status/675878199931371520/photo/1,,4274,1457,https://pbs.twimg.com/media/CWEzo19WoAEiOCj.jpg,1,Wood rabbit,0.785756,False,Hare,0.118181,False,Cardigan,0.0436271,True
675853064436391936,2015-12-12 17:41:41-08:00,Twitter for iPhone,Here we have an entire platoon of puppers. Total score:  would pet all at once ,88,80,,pupper,https://twitter.com/dog_rates/status/675853064436391936/photo/1,,2750,1356,https://pbs.twimg.com/media/CWEcxqWVEAAHyGH.jpg,1,Labrador retriever,0.868367,True,Golden retriever,0.0433046,True,Vizsla,0.0282072,True
675845657354215424,2015-12-12 17:12:15-08:00,Twitter for iPhone,"This is Pepper. She's not fully comfortable riding her imaginary bike yet.  don't worry pupper, it gets easier ",10,10,Pepper,pupper,https://twitter.com/dog_rates/status/675845657354215424/photo/1,,2338,927,https://pbs.twimg.com/media/CWEWClfW4AAnqhG.jpg,1,Pug,0.8839520000000001,True,Boston bull,0.0110568,True,French bulldog,0.00983981,True
675822767435051008,2015-12-12 15:41:18-08:00,Twitter for iPhone,ðŸŽ¶ HELLO FROM THE OTHER SIIIIIIIIDE ðŸŽ¶ s ,10,10,,,https://twitter.com/dog_rates/status/675822767435051008/photo/1,,1560,558,https://pbs.twimg.com/media/CWEBOFYWwAA-O2c.jpg,1,Pomeranian,0.4607100000000001,True,Chow,0.202765,True,Pekinese,0.133266,True
675820929667219457,2015-12-12 15:34:00-08:00,Twitter for iPhone,Here's a handful of sleepy puppers. All look unaware of their surroundings. Lousy guard dogs. Still cute tho s ,11,10,,pupper,https://twitter.com/dog_rates/status/675820929667219457/photo/1,,1077,240,https://pbs.twimg.com/media/CWD_jQMWEAAdYwH.jpg,1,Basset,0.556373,True,Beagle,0.201675,True,Bloodhound,0.110848,True
675798442703122432,2015-12-12 14:04:39-08:00,Twitter for iPhone,This is Bernie. He just touched a boob for the first time.  ,10,10,Bernie,,https://twitter.com/dog_rates/status/675798442703122432/photo/1,,10498,3532,https://pbs.twimg.com/media/CWDrGH4UYAARoq_.jpg,1,Beagle,0.681218,True,Basset,0.125121,True,Boxer,0.0803982,True
675781562965868544,2015-12-12 12:57:34-08:00,Twitter for iPhone,Say hello to Buddah. He was Waldo for Halloween.  ,11,10,Buddah,,https://twitter.com/dog_rates/status/675781562965868544/photo/1,,1658,495,https://pbs.twimg.com/media/CWDbv2yU4AARfeH.jpg,1,Maltese dog,0.921968,True,West highland white terrier,0.0178107,True,Toy poodle,0.0135554,True
675740360753160193,2015-12-12 10:13:51-08:00,Twitter for iPhone,Here's a pupper licking in slow motion.  please enjoy ,12,10,,pupper,https://twitter.com/dog_rates/status/675740360753160193/video/1,,1196,361,https://pbs.twimg.com/ext_tw_video_thumb/675740268751138818/pu/img/dVaVeFAVT-lk_1ZV.jpg,1,Golden retriever,0.800495,True,Kuvasz,0.0977564,True,Saluki,0.0684146,True
675710890956750848,2015-12-12 08:16:45-08:00,Twitter for iPhone,This is Lenny. He was just told that he couldn't explore the fish tank.  smh all that work for nothing ,12,10,Lenny,,https://twitter.com/dog_rates/status/675710890956750848/photo/1,,1933,859,https://pbs.twimg.com/media/CWCbd8ZWoAAtqoH.jpg,2,Standard schnauzer,0.4414270000000001,True,Miniature schnauzer,0.248885,True,Sealyham terrier,0.164967,True
675706639471788032,2015-12-12 07:59:51-08:00,Twitter for iPhone,This is a Sizzlin Menorah spaniel from Brooklyn named Wylie. Lovable eyes. Chiller as hell.  and I'm out.. poof ,10,10,,,https://twitter.com/dog_rates/status/675706639471788032/photo/1,,657,102,https://pbs.twimg.com/media/CWCXj35VEAIFvtk.jpg,1,English springer,0.9903,True,Welsh springer spaniel,0.00207991,True,Cocker spaniel,0.00201378,True
675534494439489536,2015-12-11 20:35:48-08:00,Twitter for iPhone,Seriously guys?! Only send in dogs. I only rate dogs. This is a baby black bear...  ,11,10,,,https://twitter.com/dog_rates/status/675534494439489536/photo/1,,1862,435,https://pbs.twimg.com/media/CV_7CV6XIAEV05u.jpg,1,Chow,0.749368,True,Schipperke,0.13373800000000002,True,Newfoundland,0.0499138,True
675531475945709568,2015-12-11 20:23:49-08:00,Twitter for iPhone,This is Ellie AKA Queen Slayer of the Orbs. Very self-motivated. Great yard. Rad foliage.  would pet diligently ,10,10,Ellie,,https://twitter.com/dog_rates/status/675531475945709568/photo/1,,1211,402,https://pbs.twimg.com/media/CV_4ShmUYAA3wNu.jpg,1,Pembroke,0.918441,True,Cardigan,0.0273395,True,Siberian husky,0.020221,True
675522403582218240,2015-12-11 19:47:46-08:00,Twitter for iPhone,Meet Sammy. He's a Motorola Firefox. Hat under hoodie (must be a half-decent up and coming white rapper)  ,10,10,Sammy,,https://twitter.com/dog_rates/status/675522403582218240/photo/1,,1065,297,https://pbs.twimg.com/media/CV_wCh8W4AEWWZ9.jpg,1,Cocker spaniel,0.299708,True,Golden retriever,0.263665,True,Irish setter,0.0803233,True
675517828909424640,2015-12-11 19:29:35-08:00,Twitter for iPhone, stay woke ,12,10,,,https://twitter.com/dog_rates/status/675517828909424640/photo/1,,1324,475,https://pbs.twimg.com/media/CV_r3v4VAAALvwg.jpg,1,Scottish deerhound,0.240591,True,Groenendael,0.156916,True,Flat-coated retriever,0.0908994,True
675501075957489664,2015-12-11 18:23:01-08:00,Twitter for iPhone,"I shall call him squishy and he shall be mine, and he shall be my squishy.  ",13,10,,,https://twitter.com/dog_rates/status/675501075957489664/photo/1,,17519,6046,https://pbs.twimg.com/media/CV_cnjHWUAADc-c.jpg,1,Dough,0.806757,False,Bakery,0.0279066,False,French loaf,0.0181889,False
675497103322386432,2015-12-11 18:07:14-08:00,Twitter for iPhone,Meet Reggie. He's going for the world record. Must concentrate. Focus up pup.  we all believe in you Reggie ,11,10,Reggie,,https://twitter.com/dog_rates/status/675497103322386432/photo/1,,3208,1351,https://pbs.twimg.com/media/CV_ZAhcUkAUeKtZ.jpg,1,Vizsla,0.5195890000000001,True,Miniature pinscher,0.0647712,True,Rhodesian ridgeback,0.0614913,True
675483430902214656,2015-12-11 17:12:54-08:00,Twitter for iPhone,Rare shielded battle dog here. Very happy about abundance of lettuce. Painfully slow fetcher. Still petable.  ,5,10,,,https://twitter.com/dog_rates/status/675483430902214656/photo/1,,1886,1013,https://pbs.twimg.com/media/CV_MmGZU8AAggM6.jpg,1,Box turtle,0.543706,False,Terrapin,0.2026,False,Loggerhead,0.0711215,False
675432746517426176,2015-12-11 13:51:30-08:00,Twitter for iPhone,Happy Friday. Here's some golden puppers.  for all ,12,10,,pupper,https://twitter.com/dog_rates/status/675432746517426176/photo/1,,1560,593,https://pbs.twimg.com/media/CV-ef64WoAAbh0I.jpg,1,Labrador retriever,0.986548,True,Golden retriever,0.00886185,True,Chihuahua,0.000693528,True
675372240448454658,2015-12-11 09:51:04-08:00,Twitter for iPhone,"The tail alone is . Great dog, better owner ",13,10,,,https://twitter.com/dog_rates/status/675372240448454658/photo/1,,1730,529,https://pbs.twimg.com/media/CV9nd30XAAAEba5.jpg,1,Chihuahua,0.4163850000000001,True,West highland white terrier,0.102933,True,Samoyed,0.0872995,True
675362609739206656,2015-12-11 09:12:48-08:00,Twitter for iPhone,This is Daisy. She loves that shoe. Still no seat belt. Super churlish.  the dogs are killing it today ,12,10,Daisy,,https://twitter.com/dog_rates/status/675362609739206656/photo/1,,1071,237,https://pbs.twimg.com/media/CV9etctWUAAl5Hp.jpg,1,Labrador retriever,0.479008,True,Ice bear,0.218289,False,Kuvasz,0.13991099999999998,True
675354435921575936,2015-12-11 08:40:19-08:00,Twitter Web Client,Everyone needs to watch this.  ,13,10,,,https://twitter.com/dog_rates/status/675354435921575936/video/1,,33554,17893,https://pbs.twimg.com/ext_tw_video_thumb/675354114423808004/pu/img/qL1R_nGLqa6lmkOx.jpg,1,Upright,0.303415,False,Golden retriever,0.181351,True,Brittany spaniel,0.16208399999999998,True
675334060156301312,2015-12-11 07:19:21-08:00,Twitter for iPhone,Good morning here's a grass pupper.  ,12,10,,pupper,https://twitter.com/dog_rates/status/675334060156301312/photo/1,,2842,1345,https://pbs.twimg.com/media/CV9EvZNUwAAgLCK.jpg,2,Pembroke,0.773135,True,Cardigan,0.11681,True,Chow,0.0390362,True
675166823650848770,2015-12-10 20:14:49-08:00,Twitter for iPhone,This is Arnold. He broke his leg saving a handicapped child from a forest fire. True hero.  inspirational dog ,10,10,Arnold,,https://twitter.com/dog_rates/status/675166823650848770/photo/1,,3684,1672,https://pbs.twimg.com/media/CV6spB7XAAIpMyP.jpg,1,Llama,0.284394,False,Standard poodle,0.132569,True,Teddy,0.127975,False
675153376133427200,2015-12-10 19:21:23-08:00,Twitter for iPhone,What kind of person sends in a picture without a dog in it?  just because that's a nice table ,1,10,,,https://twitter.com/dog_rates/status/675153376133427200/photo/1,,6416,2710,https://pbs.twimg.com/media/CV6gaUUWEAAnETq.jpg,1,Paper towel,0.327957,False,Mailbox,0.09602689999999997,False,Seat belt,0.034995099999999994,False
675149409102012420,2015-12-10 19:05:37-08:00,Twitter for iPhone,holy shit  ,12,10,,,https://twitter.com/dog_rates/status/675149409102012420/photo/1,,3819,1747,https://pbs.twimg.com/media/CV6czeEWEAEdChp.jpg,1,Chow,0.999876,True,Tibetan mastiff,5.86749e-05,True,Tibetan terrier,2.87785e-05,True
675147105808306176,2015-12-10 18:56:28-08:00,Twitter for iPhone,When you're presenting a group project and the 4th guy tells the teacher that he did all the work.  ,10,10,,,https://twitter.com/dog_rates/status/675147105808306176/photo/1,,963,249,https://pbs.twimg.com/media/CV6atgoWcAEsdv6.jpg,1,Golden retriever,0.949215,True,Labrador retriever,0.016765400000000003,True,Flat-coated retriever,0.0106373,True
675146535592706048,2015-12-10 18:54:12-08:00,Twitter for iPhone,This is Coops. He's yelling at the carpet. Not very productive Coops.  ,7,10,Coops,,https://twitter.com/dog_rates/status/675146535592706048/photo/1,,1216,326,https://pbs.twimg.com/media/CV6aMToXIAA7kH4.jpg,1,Dingo,0.28844699999999995,False,Cardigan,0.229944,True,Pembroke,0.190407,True
675145476954566656,2015-12-10 18:49:59-08:00,Twitter for iPhone,What an honor. 3 dogs here. Blond one is clearly a gymnast. Other two just confused. Very nifty pups.  for all ,9,10,,,https://twitter.com/dog_rates/status/675145476954566656/photo/1,,2179,939,https://pbs.twimg.com/media/CV6ZOPqWsAA20Uj.jpg,1,Labrador retriever,0.458746,True,Great dane,0.235504,True,Staffordshire bullterrier,0.116864,True
675135153782571009,2015-12-10 18:08:58-08:00,Twitter for iPhone,This is Steven. He got locked outside. Damn it Steven.  nice grill tho ,5,10,Steven,,https://twitter.com/dog_rates/status/675135153782571009/photo/1,,1321,512,https://pbs.twimg.com/media/CV6P1lnWIAAUQHk.jpg,1,Stove,0.587507,False,Rotisserie,0.0517131,False,Microwave,0.0207253,False
675113801096802304,2015-12-10 16:44:07-08:00,Twitter for iPhone,Meet Zuzu. He just graduated college. Astute pupper. Needs 2 leashes to contain him. Wasn't ready for the pic.  ,10,10,Zuzu,pupper,https://twitter.com/dog_rates/status/675113801096802304/photo/1,,1992,812,https://pbs.twimg.com/media/CV58a4nXAAApywo.jpg,1,Bow,0.16802,False,Quill,0.108807,False,Joystick,0.0433118,False
675111688094527488,2015-12-10 16:35:44-08:00,Twitter for iPhone,Say hello to Oliver. He thought what was inside the pillow should be outside the pillow. Blurry since birth.  ,8,10,Oliver,,https://twitter.com/dog_rates/status/675111688094527488/photo/1,,984,263,https://pbs.twimg.com/media/CV56f54WsAEv4kJ.jpg,1,Labrador retriever,0.631501,True,Brittany spaniel,0.101927,True,Chesapeake bay retriever,0.0626498,True
675109292475830276,2015-12-10 16:26:12-08:00,Twitter for iPhone,C'mon guys. We've been over this. We only rate dogs. This is a cow. Please only submit dogs. Thank you......  ,9,10,,,https://twitter.com/dog_rates/status/675109292475830276/photo/1,,2853,1180,https://pbs.twimg.com/media/CV54UQTXAAAGf-j.jpg,1,Dalmatian,0.989519,True,English setter,0.00525767,True,German short-haired pointer,0.00144283,True
675047298674663426,2015-12-10 12:19:52-08:00,Twitter for iPhone,This is a fluffy albino Bacardi Columbia mix. Excellent at the tweets.  would hug gently ,11,10,,,https://twitter.com/dog_rates/status/675047298674663426/photo/1,,1083,342,https://pbs.twimg.com/media/CV4_8FgXAAQOj4S.jpg,1,Samoyed,0.978007,True,Chow,0.00712124,True,Pomeranian,0.00639783,True
675015141583413248,2015-12-10 10:12:05-08:00,Twitter for iPhone,Meet Moe. He's a golden Fetty Woof. Doesn't respect the authorities. Might own a motorhome?  revolutionary pup ,10,10,Moe,,https://twitter.com/dog_rates/status/675015141583413248/photo/1,,2768,1247,https://pbs.twimg.com/media/CV4iqh5WcAEV1E6.jpg,1,Street sign,0.290091,False,Golden retriever,0.258372,True,Sandbar,0.132173,False
675006312288268288,2015-12-10 09:37:00-08:00,Twitter for iPhone,Say hello to Mollie. This pic was taken after she bet all her toys on Ronda Rousey.  hang in there pupper ,10,10,Mollie,pupper,https://twitter.com/dog_rates/status/675006312288268288/photo/1,,1005,236,https://pbs.twimg.com/media/CV4aqCwWsAIi3OP.jpg,1,Boxer,0.654697,True,Space heater,0.043388800000000005,False,Beagle,0.0428476,True
675003128568291329,2015-12-10 09:24:21-08:00,Twitter for iPhone,Meet Laela. She's adorable. Magnificent eyes. But I don't see a seat belt. Insubordinate.. and churlish. Still  ,12,10,Laela,,https://twitter.com/dog_rates/status/675003128568291329/photo/1,,1587,489,https://pbs.twimg.com/media/CV4XwYiWoAAHQIF.jpg,1,Pembroke,0.655279,True,Pomeranian,0.104164,True,Cardigan,0.0528177,True
674805413498527744,2015-12-09 20:18:42-08:00,Twitter for iPhone,When your entire life is crumbling before you and you're trying really hard to hold your shit together. ,10,10,,,https://twitter.com/dog_rates/status/674805413498527744/video/1,,877,368,https://pbs.twimg.com/ext_tw_video_thumb/674805331965399040/pu/img/-7bw8niVrgIkLKOW.jpg,1,English springer,0.594467,True,Cocker spaniel,0.389994,True,Welsh springer spaniel,0.00709611,True
674800520222154752,2015-12-09 19:59:15-08:00,Twitter for iPhone,This is Tedders. He broke his leg saving babies from the Pompeii eruption.  where's his Purple Heart? @POTUS ,11,10,Tedders,,https://twitter.com/dog_rates/status/674800520222154752/photo/1,,3066,891,https://pbs.twimg.com/media/CV1ffl3XAAAiFyr.jpg,1,Pembroke,0.8764790000000001,True,Cardigan,0.0969114,True,Dingo,0.00919567,False
674790488185167872,2015-12-09 19:19:24-08:00,Twitter for iPhone,ER... MER... GERD  ,13,10,,,https://twitter.com/dog_rates/status/674790488185167872/photo/1,,1124,260,https://pbs.twimg.com/media/CV1WXsmWcAAgQ56.jpg,1,Labrador retriever,0.8019029999999999,True,Chesapeake bay retriever,0.193575,True,Rottweiler,0.00119305,True
674788554665512960,2015-12-09 19:11:43-08:00,Twitter for iPhone,Say hello to Maggie. She's a Western Septic Downy. Pretends to be Mexican. Great hardwood flooring.  ,9,10,Maggie,,https://twitter.com/dog_rates/status/674788554665512960/photo/1,,826,218,https://pbs.twimg.com/media/CV1Um8vWIAAmhQn.jpg,1,Miniature poodle,0.349561,True,Toy poodle,0.154711,True,Maltese dog,0.134229,True
674781762103414784,2015-12-09 18:44:43-08:00,Twitter for iPhone,Bedazzled pup here. Fashionable af. Super yellow. Looks hella fluffy. Webbed paws for efficient fetching.  ,8,10,,,https://twitter.com/dog_rates/status/674781762103414784/photo/1,,2037,1248,https://pbs.twimg.com/media/CV1ObvEWcAA7c6i.jpg,1,Ocarina,0.148975,False,Hamster,0.06898489999999999,False,Wool,0.0317285,False
674774481756377088,2015-12-09 18:15:47-08:00,Twitter for iPhone,This is Superpup. His head isn't proportional to his body. Has yet to serve any justice.  maybe one day pupper ,11,10,Superpup,pupper,https://twitter.com/dog_rates/status/674774481756377088/photo/1,,1143,493,https://pbs.twimg.com/media/CV1HztsWoAAuZwo.jpg,1,Chihuahua,0.407016,True,French bulldog,0.30997800000000003,True,Siamese cat,0.227677,False
674767892831932416,2015-12-09 17:49:36-08:00,Twitter for iPhone,This pup was carefully tossed to make it look like she's riding that horse. I have no words this is fabulous.  ,12,10,,,https://twitter.com/dog_rates/status/674767892831932416/photo/1,,1861,818,https://pbs.twimg.com/media/CV1B0WkWwAEBKVx.jpg,1,Shower curtain,0.238855,False,Sarong,0.0924141,False,Kimono,0.0564125,False
674764817387900928,2015-12-09 17:37:23-08:00,Twitter for iPhone,These two pups are masters of camouflage. Very dedicated to the craft. Both must've spent decades practicing. s ,10,10,,,https://twitter.com/dog_rates/status/674764817387900928/photo/1,,796,247,https://pbs.twimg.com/media/CV0_BSuWIAIvE9k.jpg,2,Samoyed,0.634695,True,Arctic fox,0.30985300000000005,False,Kuvasz,0.019641,True
674752233200820224,2015-12-09 16:47:23-08:00,Twitter for iPhone,Everyone please just appreciate how perfect these two photos are.  for both ,12,10,,,https://twitter.com/dog_rates/status/674752233200820224/photo/1,,1484,483,https://pbs.twimg.com/media/CV0zkzEU4AAzLc5.jpg,2,Vizsla,0.665516,True,Redbone,0.17336600000000002,True,Basset,0.134783,True
674743008475090944,2015-12-09 16:10:43-08:00,Twitter for iPhone,This is Sophie. She just saw a spider.  don't just stand there Sophie ,10,10,Sophie,,https://twitter.com/dog_rates/status/674743008475090944/photo/1,,1432,574,https://pbs.twimg.com/media/CV0rL7RWEAAbhqm.jpg,1,Bernese mountain dog,0.583054,True,Shetland sheepdog,0.0659904,True,Greater swiss mountain dog,0.0652362,True
674739953134403584,2015-12-09 15:58:35-08:00,Twitter for iPhone,"""ðŸŽ¶ DO YOU BELIEVE IN LIFE AFTER LOVE ðŸŽ¶"" ",11,10,,,https://twitter.com/dog_rates/status/674739953134403584/photo/1,,1132,409,https://pbs.twimg.com/media/CV0oaHFW4AA9Coi.jpg,1,Dandie dinmont,0.17591500000000002,True,Black-footed ferret,0.0965343,False,Toy poodle,0.0641447,True
674737130913071104,2015-12-09 15:47:22-08:00,Twitter for iPhone,Meet Rufio. He is unaware of the pink legless pupper wrapped around him. Might want to get that checked   4/10 ,10,10,Rufio,pupper,https://twitter.com/dog_rates/status/674737130913071104/photo/1,,660,96,https://pbs.twimg.com/media/CV0l10AU8AAfg-a.jpg,1,Pomeranian,0.948537,True,Schipperke,0.0143099,True,Chihuahua,0.00812024,True
674690135443775488,2015-12-09 12:40:38-08:00,Twitter for iPhone,Meet Patrick. He's an exotic pup. Jumps great distances for a dog. Always gets injured when I toss him a ball.  ,3,10,Patrick,,https://twitter.com/dog_rates/status/674690135443775488/photo/1,,1169,484,https://pbs.twimg.com/media/CVz7FxXWUAAlTRP.jpg,1,Tick,0.242538,False,Nail,0.212589,False,Screw,0.17283800000000002,False
674670581682434048,2015-12-09 11:22:56-08:00,Twitter for iPhone,Meet Jeb  Bush. Jeb is somehow stuck in that fence and Bush won't stop whispering sweet nothings in his ear. s ,9,10,Jeb,,https://twitter.com/dog_rates/status/674670581682434048/photo/1,,1640,676,https://pbs.twimg.com/media/CVzpUGUWUAAo7Vn.jpg,1,Malamute,0.180079,True,Eskimo dog,0.178033,True,Siberian husky,0.07796610000000001,True
674664755118911488,2015-12-09 10:59:46-08:00,Twitter for iPhone,This is Rodman. He's getting destroyed by the surfs. Valiant effort though.  better than most puppers probably ,10,10,Rodman,pupper,https://twitter.com/dog_rates/status/674664755118911488/photo/1,,942,263,https://pbs.twimg.com/media/CVzkA7-WsAAcXz6.jpg,1,African crocodile,0.330625,False,American alligator,0.0753557,False,Mink,0.0574807,False
