tweet_id,timestamp,source,text,rating_numerator,rating_denominator,name,dog_stage,expanded_link_1,expanded_link_2,favorite_count,retweet_count,jpg_url,img_num,p1,p1_conf,p1_dog,p2,p2_conf,p2_dog,p3,p3_conf,p3_dog
716791146589110272,2016-04-03 17:55:01-07:00,Twitter for iPhone,Meet Jennifur. She's supposed to be navigating. Not even buckled up. Insubordinate  churlish.  would still pet ,11,10,Jennifur,,https://twitter.com/dog_rates/status/716791146589110272/photo/1,,6205,1512,https://pbs.twimg.com/media/CfKNvU8WsAAvI9Z.jpg,1,Pomeranian,0.468751,True,Seat belt,0.154652,False,Golden retriever,0.12501700000000002,True
716439118184652801,2016-04-02 18:36:11-07:00,Twitter for iPhone,This is Bluebert. He just saw that both #FinalFur match ups are split 50/50. Amazed af.  ,11,10,Bluebert,,https://twitter.com/dog_rates/status/716439118184652801/photo/1,,2454,222,https://pbs.twimg.com/media/CfFNk7cWAAA-hND.jpg,1,Siberian husky,0.396495,True,Malamute,0.31705300000000003,True,Eskimo dog,0.273419,True
716285507865542656,2016-04-02 08:25:47-07:00,Twitter for iPhone,This is Stephanus. She stays woke.  ,12,10,Stephanus,,https://twitter.com/dog_rates/status/716285507865542656/photo/1,,2883,1144,https://pbs.twimg.com/media/CfDB3aJXEAAEZNv.jpg,1,Yorkshire terrier,0.43042,True,Silky terrier,0.196769,True,Cairn,0.07267610000000001,True
716080869887381504,2016-04-01 18:52:38-07:00,Twitter for iPhone,Here's a super majestic doggo and a sunset  ,11,10,,doggo,https://twitter.com/dog_rates/status/716080869887381504/photo/1,,6980,2021,https://pbs.twimg.com/media/CfAHv83UMAIEQYx.jpg,1,Golden retriever,0.638625,True,Chow,0.254717,True,Tibetan mastiff,0.0717317,True
715928423106027520,2016-04-01 08:46:52-07:00,Twitter for iPhone,This is Bubbles. He's a Yorkshire Piccolope.  would snug aggressively ,11,10,Bubbles,,https://twitter.com/dog_rates/status/715928423106027520/photo/1,,3308,921,https://pbs.twimg.com/media/Ce99GhLW8AAHG38.jpg,1,Pug,0.976685,True,French bulldog,0.0196626,True,Bull mastiff,0.00227819,True
715733265223708672,2016-03-31 19:51:22-07:00,Twitter for iPhone,This is a taco. We only rate dogs. Please only send in dogs. Dogs are what we rate. Not tacos. Thank you...  ,10,10,,,https://twitter.com/dog_rates/status/715733265223708672/photo/1,,4843,1777,https://pbs.twimg.com/media/Ce7LlUeUUAEQkQl.jpg,1,Dandie dinmont,0.740229,True,Miniature poodle,0.0819151,True,Toy poodle,0.0637485,True
715696743237730304,2016-03-31 17:26:15-07:00,Twitter for iPhone,Meet Toby. He's a Lithuanian High-Steppin Stickeroo. One of the more accomplished Stickeroos around.  so nifty ,10,10,Toby,,https://twitter.com/dog_rates/status/715696743237730304/photo/1,,4046,1355,https://pbs.twimg.com/media/Ce6qZC2WAAAcSoI.jpg,1,Staffordshire bullterrier,0.427836,True,Pug,0.221409,True,French bulldog,0.132135,True
715680795826982913,2016-03-31 16:22:53-07:00,Twitter for iPhone,This is Zeus. He's downright fabulous.  ,12,10,Zeus,,https://twitter.com/dog_rates/status/715680795826982913/photo/1,,4489,1708,https://pbs.twimg.com/media/Ce6b4MPWwAA22Xm.jpg,1,Golden retriever,0.990715,True,Labrador retriever,0.00222834,True,Chow,0.00119715,True
715360349751484417,2016-03-30 19:09:32-07:00,Twitter for iPhone,This is Bertson. He just wants to say hi.  would boop nose ,11,10,Bertson,,https://twitter.com/dog_rates/status/715360349751484417/photo/1,,5678,1659,https://pbs.twimg.com/media/Ce14cOvWwAAcFJH.jpg,1,Nail,0.8555520000000001,False,Screw,0.0732773,False,Padlock,0.0239704,False
715342466308784130,2016-03-30 17:58:29-07:00,Twitter for iPhone,This is Oscar. He's a world renowned snowball inspector. It's a ruff job but someone has to do it.  great guy ,10,10,Oscar,,https://twitter.com/dog_rates/status/715342466308784130/photo/1,,3146,719,https://pbs.twimg.com/media/Ce1oLNqWAAE34w7.jpg,1,West highland white terrier,0.597111,True,Soft-coated wheaten terrier,0.142993,True,Lakeland terrier,0.136712,True
715220193576927233,2016-03-30 09:52:36-07:00,Twitter for iPhone,This is Nico. His selfie game is strong af. Excellent use of a sneaky tongue slip.  star material ,10,10,Nico,,https://twitter.com/dog_rates/status/715220193576927233/photo/1,,2509,688,https://pbs.twimg.com/media/Cez49UqWsAIRQXc.jpg,1,Chihuahua,0.584026,True,Italian greyhound,0.377077,True,Boston bull,0.017400400000000003,True
715200624753819648,2016-03-30 08:34:51-07:00,Twitter for iPhone,This is Michelangelope. He's half coffee cup. Rare af.  would hug until someone stopped me ,12,10,Michelangelope,,https://twitter.com/dog_rates/status/715200624753819648/photo/1,,5316,1988,https://pbs.twimg.com/media/CeznK6IWEAEFUPq.jpg,1,Chihuahua,0.956787,True,Beagle,0.00838287,True,Labrador retriever,0.00834409,True
715009755312439296,2016-03-29 19:56:24-07:00,Twitter for iPhone,This is Siba. She's remarkably mobile. Very sleepy as well.  would happily transport ,12,10,Siba,,https://twitter.com/dog_rates/status/715009755312439296/photo/1,,4327,1305,https://pbs.twimg.com/media/Cew5kyOWsAA8Y_o.jpg,1,Dingo,0.31090300000000004,False,Chihuahua,0.142288,True,Cardigan,0.103945,True
714982300363173890,2016-03-29 18:07:18-07:00,Twitter for iPhone,This is Calbert. He forgot to clear his Google search history.  rookie mistake Calbert ,9,10,Calbert,,https://twitter.com/dog_rates/status/714982300363173890/photo/1,,3895,1085,https://pbs.twimg.com/media/CewgnHAXEAAdbld.jpg,1,Brittany spaniel,0.944376,True,Beagle,0.0254353,True,Ibizan hound,0.00996204,True
714957620017307648,2016-03-29 16:29:14-07:00,Twitter for iPhone,This is Curtis. He's an Albino Haberdasher. Terrified of dandelions. They really spook him up.  it'll be ok pup ,10,10,Curtis,,https://twitter.com/dog_rates/status/714957620017307648/photo/1,,4288,1496,https://pbs.twimg.com/media/CewKKiOWwAIe3pR.jpg,1,Great pyrenees,0.251516,True,Samoyed,0.139346,True,Kuvasz,0.129005,True
714631576617938945,2016-03-28 18:53:39-07:00,Twitter for iPhone,This is Benedict. He's a feisty pup. Needs a brushing. Portable af. Looks very angry actually.  might not pet ,4,10,Benedict,,https://twitter.com/dog_rates/status/714631576617938945/photo/1,,3389,1058,https://pbs.twimg.com/media/CerhoBWWAAA5eLL.jpg,1,Meerkat,0.143497,False,Weasel,0.117402,False,Black-footed ferret,0.0999327,False
714606013974974464,2016-03-28 17:12:05-07:00,Twitter for iPhone,Here are two lil cuddly puppers. Both  would snug like so much ,12,10,,pupper,https://twitter.com/dog_rates/status/714606013974974464/photo/1,,3766,973,https://pbs.twimg.com/media/CerKYG8WAAM1aE-.jpg,1,Norfolk terrier,0.293007,True,Labrador retriever,0.256198,True,Golden retriever,0.129643,True
714258258790387713,2016-03-27 18:10:13-07:00,Twitter for iPhone,Meet Travis and Flurp. Travis is pretty chill but Flurp can't lie down properly.   8/10get it together Flurp ,10,10,Travis,,https://twitter.com/dog_rates/status/714258258790387713/photo/1,,3138,755,https://pbs.twimg.com/media/CemOGNjWQAEoN7R.jpg,1,Collie,0.176758,True,Chesapeake bay retriever,0.101834,True,Beagle,0.101294,True
714251586676113411,2016-03-27 17:43:43-07:00,Twitter for iPhone,This is Thumas. He hates potted plants.  wtf Thumas ,8,10,Thumas,,https://twitter.com/dog_rates/status/714251586676113411/photo/1,,3389,884,https://pbs.twimg.com/media/CemIBt4WwAQqhVV.jpg,2,Soft-coated wheaten terrier,0.751962,True,Bedlington terrier,0.175652,True,Great pyrenees,0.0114524,True
714214115368108032,2016-03-27 15:14:49-07:00,Twitter for iPhone,Happy Easter from the squad! ðŸ‡ðŸ¶  for all ,13,10,,,https://twitter.com/dog_rates/status/714214115368108032/photo/1,,2355,924,https://pbs.twimg.com/media/Cell8ikWIAACCJ-.jpg,1,Pug,0.533967,True,Bloodhound,0.164826,True,German shepherd,0.046524,True
714141408463036416,2016-03-27 10:25:54-07:00,Twitter for iPhone,"I know we only rate dogs, but since it's Easter I guess we could rate a bunny for a change.  petable as hell ",10,10,,,https://twitter.com/dog_rates/status/714141408463036416/photo/1,,4476,1480,https://pbs.twimg.com/media/Cekj0qwXEAAHcS6.jpg,1,Labrador retriever,0.586951,True,Golden retriever,0.378812,True,Redbone,0.00360489,True
713919462244790272,2016-03-26 19:43:58-07:00,Twitter for iPhone,This is Kanu. He's a Freckled Ticonderoga. Simply flawless.  would perform an elaborate heist to capture ,12,10,Kanu,,https://twitter.com/dog_rates/status/713919462244790272/photo/1,,3404,817,https://pbs.twimg.com/media/CehZ9mLWsAAsn28.jpg,1,Siberian husky,0.463223,True,Eskimo dog,0.389959,True,Malamute,0.0979627,True
713900603437621249,2016-03-26 18:29:02-07:00,Twitter for iPhone,Happy Saturday here's 9 puppers on a bench.  good work everybody ,99,90,,pupper,https://twitter.com/dog_rates/status/713900603437621249/photo/1,,2948,778,https://pbs.twimg.com/media/CehIzzZWQAEyHH5.jpg,1,Golden retriever,0.371816,True,Cocker spaniel,0.17741300000000002,True,Irish setter,0.0927252,True
713761197720473600,2016-03-26 09:15:05-07:00,Twitter for iPhone,This is Piper. She would really like that tennis ball core. Super sneaky tongue slip.  precious af ,12,10,Piper,,https://twitter.com/dog_rates/status/713761197720473600/photo/1,,5071,1452,https://pbs.twimg.com/media/CefKBOuWIAAIlKD.jpg,1,Brittany spaniel,0.797936,True,English springer,0.044718199999999986,True,Welsh springer spaniel,0.0379107,True
713411074226274305,2016-03-25 10:03:49-07:00,Twitter for iPhone,Here we see an extremely rare Bearded Floofmallow. Only a few left in the wild.  would pet with a purpose ,11,10,,,https://twitter.com/dog_rates/status/713411074226274305/photo/1,,4582,1363,https://pbs.twimg.com/media/CeaLlAPUMAIcC7U.jpg,1,Great pyrenees,0.720337,True,Samoyed,0.12954200000000002,True,Kuvasz,0.122451,True
713177543487135744,2016-03-24 18:35:51-07:00,Twitter for iPhone,This is Lance. Lance doesn't give a shit.  we should all be more like Lance ,10,10,Lance,,https://twitter.com/dog_rates/status/713177543487135744/photo/1,,7479,2982,https://pbs.twimg.com/media/CeW3MWMWQAEOMbq.jpg,1,Whippet,0.734244,True,Basenji,0.025948,True,Great dane,0.0258743,True
713175907180089344,2016-03-24 18:29:21-07:00,Twitter for iPhone,Say hello to Opie and Clarkus. Clarkus fell asleep so Opie buried him. Ruthless af  for both ,10,10,Opie,,https://twitter.com/dog_rates/status/713175907180089344/photo/1,,4623,1534,https://pbs.twimg.com/media/CeW1tERWAAAA9Q2.jpg,1,Timber wolf,0.503788,False,Malamute,0.430624,True,Siberian husky,0.0284542,True
712809025985978368,2016-03-23 18:11:29-07:00,Twitter for iPhone,This is Stubert. He just arrived.  ,10,10,Stubert,,https://twitter.com/dog_rates/status/712809025985978368/photo/1,,19278,7100,https://pbs.twimg.com/media/CeRoBaxWEAABi0X.jpg,1,Labrador retriever,0.8686709999999999,True,Carton,0.0950952,False,Pug,0.00765137,True
712717840512598017,2016-03-23 12:09:09-07:00,Twitter for iPhone,Please don't send in any more polar bears. We only rate dogs. Thank you...  ,10,10,,,https://twitter.com/dog_rates/status/712717840512598017/photo/1,,12820,5273,https://pbs.twimg.com/media/CeQVF1eVIAAJaTv.jpg,1,Great pyrenees,0.732043,True,Kuvasz,0.121375,True,Irish wolfhound,0.0495237,True
712668654853337088,2016-03-23 08:53:42-07:00,Twitter for iPhone,Say hello to Sunny and Roxy. They pull things out of water together.  for both ,10,10,Sunny,,https://twitter.com/dog_rates/status/712668654853337088/photo/1,,4311,1280,https://pbs.twimg.com/media/CePoVTyWsAQEz1g.jpg,1,Labrador retriever,0.829058,True,Golden retriever,0.0386645,True,Chihuahua,0.0262214,True
712438159032893441,2016-03-22 17:37:48-07:00,Twitter for iPhone,This is Kane. He's a semi-submerged Haitian Huffleplop. Happy af. Sick waterfall.  would pat head approvingly ,11,10,Kane,,https://twitter.com/dog_rates/status/712438159032893441/photo/1,,5528,1649,https://pbs.twimg.com/media/CeMWubMWwAA6GwF.jpg,1,Ice bear,0.869477,False,Great pyrenees,0.069457,True,Labrador retriever,0.02474,True
712097430750289920,2016-03-21 19:03:52-07:00,Twitter for iPhone,I can't even comprehend how confused this dog must be right now.  ,10,10,,,https://twitter.com/dog_rates/status/712097430750289920/photo/1,,3936,1096,https://pbs.twimg.com/media/CeHg1klW8AE4YOB.jpg,1,Labrador retriever,0.720481,True,Whippet,0.048031800000000006,True,Chesapeake bay retriever,0.0450464,True
712092745624633345,2016-03-21 18:45:15-07:00,Twitter for iPhone,This is Steven. He's inverted af. Also very helpful. Scans anything you want for free. Takes him a while tho.  ,7,10,Steven,,https://twitter.com/dog_rates/status/712092745624633345/photo/1,,3054,942,https://pbs.twimg.com/media/CeHckpuW4AAF7rT.jpg,1,Triceratops,0.235373,False,Llama,0.153126,False,Three-toed sloth,0.11184,False
712085617388212225,2016-03-21 18:16:55-07:00,Twitter for iPhone,Say hello to Olive and Ruby. They are best buddies. Both  1 like = 1 buddy ,11,10,Olive,,https://twitter.com/dog_rates/status/712085617388212225/photo/1,,3372,509,https://pbs.twimg.com/media/CeHWFksXIAAyypp.jpg,2,Shih-tzu,0.625129,True,Tibetan terrier,0.126897,True,Lhasa,0.119663,True
712065007010385924,2016-03-21 16:55:01-07:00,Twitter for iPhone,This is Chester. He's clearly in charge of the other dogs. Weird ass paws. Not fit for fetch.  would still pet ,6,10,Chester,,https://twitter.com/dog_rates/status/712065007010385924/photo/1,,2349,662,https://pbs.twimg.com/media/CeHDV73W0AM5Cf8.jpg,1,Goose,0.214301,False,Gibbon,0.084253,False,Pizza,0.0801683,False
711968124745228288,2016-03-21 10:30:03-07:00,Twitter for iPhone,Meet Winston. He's trapped in a cup of coffee. Poor pupper.  someone free him ,10,10,Winston,pupper,https://twitter.com/dog_rates/status/711968124745228288/photo/1,,8366,2442,https://pbs.twimg.com/media/CeFrO3qXEAADRbd.jpg,1,Espresso,0.4301350000000001,False,Coffee mug,0.418483,False,Cup,0.08839119999999999,False
711743778164514816,2016-03-20 19:38:34-07:00,Twitter for iPhone,Meet Roosevelt. He's calculating the best case scenario if he drops out instead of doing math hw.  relatable af ,11,10,Roosevelt,,https://twitter.com/dog_rates/status/711743778164514816/photo/1,,2947,1038,https://pbs.twimg.com/media/CeCfMPDW0AAAEUj.jpg,1,Lakeland terrier,0.459515,True,Miniature poodle,0.219661,True,Standard poodle,0.130189,True
711732680602345472,2016-03-20 18:54:29-07:00,Twitter for iPhone,I want to hear the joke this dog was just told.  ,10,10,,,https://twitter.com/dog_rates/status/711732680602345472/photo/1,,9226,4356,https://pbs.twimg.com/media/CeCVGEbUYAASeY4.jpg,3,Dingo,0.366875,False,Ibizan hound,0.334929,True,Eskimo dog,0.07387619999999999,True
711694788429553666,2016-03-20 16:23:54-07:00,Twitter for iPhone,Oh. My. God.  magical af ,13,10,,,https://twitter.com/dog_rates/status/711694788429553666/photo/1,,34139,19292,https://pbs.twimg.com/tweet_video_thumb/CeBym7oXEAEWbEg.jpg,1,Brown bear,0.7132930000000001,False,Indian elephant,0.172844,False,Water buffalo,0.0389022,False
711652651650457602,2016-03-20 13:36:28-07:00,Twitter for iPhone,This is Gary. He just wanted to say hi.  very personable pup ,9,10,Gary,,https://twitter.com/dog_rates/status/711652651650457602/photo/1,,4018,971,https://pbs.twimg.com/media/CeBMT6-WIAA7Qqf.jpg,1,Llama,0.8567889999999999,False,Arabian camel,0.098727,False,Neck brace,0.0163772,False
711363825979756544,2016-03-19 18:28:47-07:00,Twitter for iPhone,"""Please, no puparazzi""  ",11,10,,,https://twitter.com/dog_rates/status/711363825979756544/photo/1,,3802,1196,https://pbs.twimg.com/media/Cd9Fn5QUMAAYMT4.jpg,1,Pembroke,0.7509060000000001,True,Cardigan,0.241152,True,Basenji,0.00263962,True
711306686208872448,2016-03-19 14:41:44-07:00,Twitter for iPhone,What hooligan sent in pictures w/out a dog in them? Churlish af.  just bc that's a neat fluffy bean bag chair ,3,10,,,https://twitter.com/dog_rates/status/711306686208872448/photo/1,,3445,770,https://pbs.twimg.com/media/Cd8Rpl0W0AAN1kU.jpg,1,Leatherback turtle,0.280835,False,Loggerhead,0.12329,False,Dandie dinmont,0.0867925,True
711008018775851008,2016-03-18 18:54:56-07:00,Twitter for iPhone,This is Chuckles. He had a balloon but he accidentally let go of it and it floated away.  hang in there pupper ,11,10,Chuckles,pupper,https://twitter.com/dog_rates/status/711008018775851008/photo/1,,3111,649,https://pbs.twimg.com/media/Cd4CBQFW8AAY3ND.jpg,1,French bulldog,0.731405,True,Boston bull,0.150672,True,Pug,0.0218109,True
710997087345876993,2016-03-18 18:11:29-07:00,Twitter for iPhone,Meet Milo and Amos. They are the best of pals. Both  would pet at the same time ,12,10,Milo,,https://twitter.com/dog_rates/status/710997087345876993/photo/1,,4735,1464,https://pbs.twimg.com/media/Cd34FClUMAAnvGP.jpg,1,Malamute,0.28126,True,Eskimo dog,0.232641,True,Pembroke,0.091602,True
710844581445812225,2016-03-18 08:05:29-07:00,Twitter for iPhone,This is Staniel. His selfie game is strong af.  I'd snapchat with Staniel ,10,10,Staniel,,https://twitter.com/dog_rates/status/710844581445812225/photo/1,,2647,728,https://pbs.twimg.com/media/Cd1tYGmXIAAoW5b.jpg,1,Dingo,0.536593,False,Pembroke,0.200407,True,Basenji,0.0607345,True
710833117892898816,2016-03-18 07:19:56-07:00,Twitter for iPhone,Say hello to Sora. She's an Egyptian Pumpernickel. Mesmerizing af.  would bring home to mom ,12,10,Sora,,https://twitter.com/dog_rates/status/710833117892898816/photo/1,,2795,567,https://pbs.twimg.com/media/Cd1i8qvUkAE-Jlr.jpg,1,Pembroke,0.803742,True,Cardigan,0.189712,True,German shepherd,0.00174609,True
710658690886586372,2016-03-17 19:46:49-07:00,Twitter for iPhone,Here's a brigade of puppers. All look very prepared for whatever happens next.  ,80,80,,pupper,https://twitter.com/dog_rates/status/710658690886586372/photo/1,,2396,596,https://pbs.twimg.com/media/CdzETn4W4AAVU5N.jpg,1,Soft-coated wheaten terrier,0.948617,True,Dandie dinmont,0.0186644,True,Cairn,0.0159427,True
710588934686908417,2016-03-17 15:09:38-07:00,Twitter for iPhone,This is Beemo. He's a Chubberflop mix.  would cross the world for ,12,10,Beemo,,https://twitter.com/dog_rates/status/710588934686908417/photo/1,,4721,1978,https://pbs.twimg.com/media/CdyE2x1W8AAe0TG.jpg,4,Pembroke,0.982004,True,Cardigan,0.00894347,True,Malamute,0.007549899999999998,True
710283270106132480,2016-03-16 18:55:02-07:00,Twitter for iPhone,This is Gunner. He's a Figamus Newton. King of the peek-a-boo. Cool jeans.  ,11,10,Gunner,,https://twitter.com/dog_rates/status/710283270106132480/photo/1,,2222,543,https://pbs.twimg.com/media/Cdtu3WRUkAAsRVx.jpg,2,Shih-tzu,0.932401,True,Lhasa,0.0308057,True,Tibetan terrier,0.00897428,True
710272297844797440,2016-03-16 18:11:26-07:00,Twitter for iPhone,We ðŸ‘ðŸ» only ðŸ‘ðŸ» rate ðŸ‘ðŸ» dogs. Pls stop sending in non-canines like this Dutch Panda Worm. This is infuriating.  ,11,10,,,https://twitter.com/dog_rates/status/710272297844797440/photo/1,,4713,1325,https://pbs.twimg.com/media/Cdtk414WoAIUG0v.jpg,1,Old english sheepdog,0.586307,True,Wire-haired fox terrier,0.118622,True,Lakeland terrier,0.106806,True
710269109699739648,2016-03-16 17:58:46-07:00,Twitter for iPhone,The squad is back for St. Patrick's Day! â˜˜ ðŸ’š for all ,13,10,,,https://twitter.com/dog_rates/status/710269109699739648/photo/1,,2491,1189,https://pbs.twimg.com/media/Cdth_KyWEAEXH3u.jpg,1,Pug,0.415495,True,German shepherd,0.17815699999999998,True,Labrador retriever,0.100202,True
710153181850935296,2016-03-16 10:18:07-07:00,Twitter for iPhone,This is Lacy. She's tipping her hat to you. Daydreams of her life back on the frontier.  would pet so well ,11,10,Lacy,,https://twitter.com/dog_rates/status/710153181850935296/photo/1,,3023,944,https://pbs.twimg.com/media/Cdr4jO2UAAAIo6W.jpg,2,Cowboy hat,0.979053,False,Sombrero,0.0106825,False,Cocker spaniel,0.00271296,True
710140971284037632,2016-03-16 09:29:35-07:00,Twitter for iPhone,This is Tater. His underbite is fierce af. Doesn't give a damn about your engagement photo.  ,8,10,Tater,,https://twitter.com/dog_rates/status/710140971284037632/photo/1,,2873,937,https://pbs.twimg.com/media/Cdrtcr-W4AAqi5H.jpg,1,Pekinese,0.95317,True,Papillon,0.0195169,True,Japanese spaniel,0.00582051,True
710117014656950272,2016-03-16 07:54:24-07:00,Twitter for iPhone,This pupper got her hair chalked for her birthday. Hasn't told her parents yet. Rebellious af.  very nifty ,11,10,,pupper,https://twitter.com/dog_rates/status/710117014656950272/photo/1,,5723,2104,https://pbs.twimg.com/media/CdrXp9dWoAAcRfn.jpg,2,Toy poodle,0.802092,True,Miniature poodle,0.111647,True,Cocker spaniel,0.0628662,True
709918798883774466,2016-03-15 18:46:45-07:00,Twitter for iPhone,Meet Watson. He's a Suzuki Tickleboop. Leader of a notorious biker gang. Only one ear functional.  snuggable af ,12,10,Watson,,https://twitter.com/dog_rates/status/709918798883774466/photo/1,,3107,1123,https://pbs.twimg.com/media/CdojYQmW8AApv4h.jpg,2,Pembroke,0.956222,True,Cardigan,0.0207273,True,Chihuahua,0.00791218,True
709852847387627521,2016-03-15 14:24:41-07:00,Twitter for iPhone,*lets out a tiny whimper and then collapses* ... ,12,10,,,https://twitter.com/dog_rates/status/709852847387627521/photo/1,,3648,1261,https://pbs.twimg.com/media/CdnnZhhWAAEAoUc.jpg,2,Chihuahua,0.945629,True,Pomeranian,0.0192036,True,West highland white terrier,0.0101342,True
709566166965075968,2016-03-14 19:25:31-07:00,Twitter for iPhone,This is Olaf. He's gotta be rare. Seems sturdy. Tail is floofy af.  would do whatever it takes to pet ,12,10,Olaf,,https://twitter.com/dog_rates/status/709566166965075968/photo/1,,3679,1271,https://pbs.twimg.com/media/Cdjiqi6XIAIUOg-.jpg,1,Chow,0.999837,True,Tibetan mastiff,0.000116907,True,Australian terrier,1.13384e-05,True
709556954897764353,2016-03-14 18:48:55-07:00,Twitter for iPhone,This is Cecil. She's a Gigglefloof Poofer. Outdoorsy af. One with nature.  would strategically capture ,12,10,Cecil,,https://twitter.com/dog_rates/status/709556954897764353/photo/1,,3425,1121,https://pbs.twimg.com/media/CdjaSFCWAAAJZh3.jpg,2,Golden retriever,0.790026,True,Kuvasz,0.105031,True,Labrador retriever,0.0870512,True
709519240576036864,2016-03-14 16:19:03-07:00,Twitter for iPhone,This is Vince. He's a Gregorian Flapjeck. White spot on legs almost looks like another dog (whoa).  rad as hell ,9,10,Vince,,https://twitter.com/dog_rates/status/709519240576036864/photo/1,,1544,250,https://pbs.twimg.com/media/Cdi3-f7W8AUOm9T.jpg,1,Cocker spaniel,0.414982,True,Newfoundland,0.225482,True,Flat-coated retriever,0.196789,True
709449600415961088,2016-03-14 11:42:20-07:00,Twitter for iPhone,Meet Karma. She's just a head. Lost body during the Second Punic War (unfortunate). Loves to travel  petable af ,10,10,Karma,,https://twitter.com/dog_rates/status/709449600415961088/photo/1,,2321,610,https://pbs.twimg.com/media/Cdh4pgAW0AEKJ_a.jpg,2,Maltese dog,0.780187,True,Dandie dinmont,0.07442869999999999,True,Norfolk terrier,0.033776199999999985,True
709409458133323776,2016-03-14 09:02:49-07:00,Twitter for iPhone,This is Billy. He sensed a squirrel.  damn it Billy ,8,10,Billy,,https://twitter.com/dog_rates/status/709409458133323776/photo/1,,2718,729,https://pbs.twimg.com/media/CdhUIMSUIAA4wYK.jpg,1,Shetland sheepdog,0.79745,True,Collie,0.0540553,True,Keeshond,0.0316733,True
709225125749587968,2016-03-13 20:50:21-07:00,Twitter for iPhone,This is Walker. He's a Butternut Khalifa. Appears fuzzy af.  would hug for a ridiculous amount of time ,11,10,Walker,,https://twitter.com/dog_rates/status/709225125749587968/photo/1,,2500,603,https://pbs.twimg.com/media/Cdese-zWEAArIqE.jpg,1,Labrador retriever,0.271109,True,Pomeranian,0.15048699999999998,True,Golden retriever,0.145578,True
709207347839836162,2016-03-13 19:39:42-07:00,Twitter for iPhone,This is Penny. She's trying on her prom dress. Stunning af  ,11,10,Penny,,https://twitter.com/dog_rates/status/709207347839836162/photo/1,,13093,6171,https://pbs.twimg.com/media/CdecUSzUIAAHCvg.jpg,1,Chihuahua,0.948323,True,Italian greyhound,0.0177303,True,Quilt,0.016687900000000002,False
709198395643068416,2016-03-13 19:04:08-07:00,Twitter for iPhone,"From left to right:Cletus, Jerome, Alejandro, Burp,  TitsonNone know where camera is.  would hug all at once ",45,50,,,https://twitter.com/dog_rates/status/709198395643068416/photo/1,,2513,675,https://pbs.twimg.com/media/CdeUKpcWoAAJAWJ.jpg,1,Borzoi,0.490783,True,Wire-haired fox terrier,0.0835133,True,English setter,0.0831843,True
709158332880297985,2016-03-13 16:24:56-07:00,Twitter for iPhone,Meet Rodney. He's a Ukranian Boomchicka. Outside but would like to be inside. Only has one ear (unfortunate)  ,10,10,Rodney,,https://twitter.com/dog_rates/status/709158332880297985/photo/1,,2115,442,https://pbs.twimg.com/media/CddvvSwWoAUObQw.jpg,1,Siberian husky,0.212957,True,Eskimo dog,0.178887,True,Labrador retriever,0.174218,True
709042156699303936,2016-03-13 08:43:18-07:00,Twitter for iPhone,This is Klevin. He's addicted to sandwiches (yes a hotdog is a sandwich fight me) It's tearing his family apart  ,9,10,Klevin,,https://twitter.com/dog_rates/status/709042156699303936/photo/1,,4941,1729,https://pbs.twimg.com/media/CdcGBB3WwAAGBuU.jpg,1,Hotdog,0.8265790000000001,False,Rottweiler,0.0681793,True,Labrador retriever,0.0492179,True
708845821941387268,2016-03-12 18:43:08-08:00,Twitter for iPhone,Here's a pupper with magic eyes. Not wearing a seat belt tho (irresponsible af). Very distracting to driver.  ,9,10,,pupper,https://twitter.com/dog_rates/status/708845821941387268/photo/1,,3102,947,https://pbs.twimg.com/media/CdZTgynWwAATZcx.jpg,1,Schipperke,0.74564,True,Kelpie,0.167853,True,Boston bull,0.0147629,True
708834316713893888,2016-03-12 17:57:25-08:00,Twitter for iPhone,Meet Malikai. He was rolling around having fun when he remembered the inevitable heat death of the universe.  ,10,10,Malikai,,https://twitter.com/dog_rates/status/708834316713893888/photo/1,,1759,533,https://pbs.twimg.com/media/CdZI_bpWEAAm1fs.jpg,1,Eskimo dog,0.283945,True,Giant panda,0.218252,False,Malamute,0.180401,True
